Production,Year,Venue/type,Music,Lyrics,Book,Notes
Quadrophenia,1996,Off-Broadway,Pete Townshend,Townshend,Townshend,"Notable song: ""Love Reign O'er Me""."
Queen O' Hearts,1922,Broadway,Lewis E. Gensler and Dudley Wilkinson,Oscar Hammerstein II,Hammerstein and Frank Mandel,
Queen of the Mist,2011,Off-Broadway,Michael John LaChiusa,,,
The Queen of Versailles,2025,Broadway,Stephen Schwartz,Schwartz,Lindsey Ferrentino,Based on the 2012 documentary of the same name
Quilters,1984,Broadway,Barbara Damashek,Damashek,Molly Newman and Damashek,
